[
{
  "id": "INIT-P02-STAFF-16",
  "image": "images/characters/camilla-attendant-1-ch416.png",
  "source_chapter": 416,
  "source_image": "ch416-20261010/03.jpg（右ページ・寝台の左側）"
},
  { "id": "EII-U01", "image": "images/characters/eii-u01-ch378.png", "source_chapter": 378, "source_image": "ch378-20261010/04.jpg" },
  { "id": "EII-U02", "image": "images/characters/eii-u02-ch378.png", "source_chapter": 378, "source_image": "ch378-20261010/04.jpg" },
  { "id": "SPD-001", "image": "images/characters/pt-manga-chrollo.webp", "source_chapter": 377, "source_image": "8-写真8.jpg" },
  { "id": "SPD-002", "image": "images/characters/pt-manga-nobunaga.webp", "source_chapter": 377, "source_image": "8-写真8.jpg" },
  { "id": "SPD-003", "image": "images/characters/pt-manga-phinks.webp", "source_chapter": 377, "source_image": "8-写真8.jpg" },
  { "id": "SPD-004", "image": "images/characters/pt-manga-feitan.webp", "source_chapter": 377, "source_image": "8-写真8.jpg" },
  { "id": "SWU-004", "image": "images/characters/lynch.webp", "source_url": "https://hunterxhunter.fandom.com/wiki/Lynch_Fullbokko" },
  { "id": "KNG-001", "image": "images/characters/nasubi.webp", "source_url": "https://hunterxhunter.fandom.com/wiki/Nasubi_Hui_Guo_Rou" },
  { "id": "P14", "image": "images/characters/woble.webp", "source_url": "https://hunterxhunter.fandom.com/wiki/Woble_Hui_Guo_Rou" },
  { "id": "Q03", "image": "images/characters/queen-tang-zhao-li.webp", "source_url": "https://hunterxhunter.fandom.com/wiki/Tang_Zhao_Li_Hui_Guo_Rou" },
  { "id": "SWU-001", "image": "images/characters/onior.webp", "source_url": "https://hunterxhunter.fandom.com/wiki/Onior_Longbao" },
  { "id": "SWU-002", "image": "images/characters/hinrigh.webp", "source_url": "https://hunterxhunter.fandom.com/wiki/Hinrigh_Biganduffno" },
  { "id": "SWU-003", "image": "images/characters/zakuro.webp", "source_url": "https://hunterxhunter.fandom.com/wiki/Zakuro_Custard" },
  { "id": "EII-002", "image": "images/characters/luini.webp", "source_url": "https://hunterxhunter.fandom.com/wiki/Luini" },
  { "id": "SAA-001", "image": "images/characters/brocco-li.webp", "source_url": "https://hunterxhunter.fandom.com/wiki/Brocco_Li" },
  { "id": "SAA-003", "image": "images/characters/ittoku.webp", "source_url": "https://hunterxhunter.fandom.com/wiki/Ittoku" },
  { "id": "HA-001", "image": "images/characters/ha-001-manga.webp", "source_chapter": 341, "source_image": "ch341-20261008/06.jpg" },
  { "id": "HA-002", "image": "images/characters/ha-002-manga.webp", "source_chapter": 346, "source_image": "ch345-346-20261010/15.jpg" },
  { "id": "HA-003", "image": "images/characters/ha-003-manga.webp", "source_chapter": 346, "source_image": "ch345-346-20261010/15.jpg" },
  { "id": "HA-004", "image": "images/characters/ha-004-manga.webp", "source_chapter": 346, "source_image": "ch345-346-20261010/16.jpg" },
  { "id": "HA-005", "image": "images/characters/ha-005-manga.webp", "source_chapter": 344, "source_image": "ch344-20261010/06.jpg" },
  { "id": "BYD-001", "image": "images/characters/beyond.webp", "source_url": "https://hunterxhunter.fandom.com/wiki/Beyond_Netero" },
  { "id": "BYD-002", "image": "images/characters/byd-002-manga.webp", "source_chapter": 343, "source_image": "ch343-20261010/04.jpg" },
  { "id": "BYD-003", "image": "images/characters/byd-003-manga.webp", "source_chapter": 344, "source_image": "ch344-20261010/10.jpg" },
  { "id": "JUD-001", "image": "images/characters/kaiser.webp", "source_url": "https://hunterxhunter.fandom.com/wiki/Kaiser" },
  { "id": "P01-P06", "image": "images/characters/furykov.webp", "source_url": "https://hunterxhunter.fandom.com/wiki/Furykov" },
  { "id": "P14-M01", "image": "images/characters/sandra.webp", "source_url": "https://hunterxhunter.fandom.com/wiki/Sandra" },
  { "id": "HA-006", "image": "images/characters/ridge.webp", "source_url": "https://hunterxhunter.fandom.com/wiki/Ridge" },
  { "id": "SPD-005", "image": "images/characters/pt-manga-franklin.webp", "source_chapter": 377, "source_image": "8-写真8.jpg" },
  { "id": "SPD-006", "image": "images/characters/pt-manga-shizuku.webp", "source_chapter": 377, "source_image": "8-写真8.jpg" },
  { "id": "SPD-007", "image": "images/characters/pt-manga-bonolenov.webp", "source_chapter": 377, "source_image": "8-写真8.jpg" },
  { "id": "EII-003", "image": "images/characters/padaille.webp", "source_url": "https://hunterxhunter.fandom.com/wiki/Padaille" },
  { "id": "EII-004", "image": "images/characters/quorolle.webp", "source_url": "https://hunterxhunter.fandom.com/wiki/Quorolle" },
  { "id": "EII-006", "image": "images/characters/misha-hao.webp", "source_url": "https://hunterxhunter.fandom.com/wiki/Misha_Hao" },
  { "id": "EII-007", "image": "images/characters/tassi.webp", "source_url": "https://hunterxhunter.fandom.com/wiki/Tassi" },
  { "id": "EII-008", "image": "images/characters/yokotani.webp", "source_url": "https://hunterxhunter.fandom.com/wiki/Yokotani" },
  { "id": "P13-G03", "image": "images/characters/vergei.webp", "source_url": "https://hunterxhunter.fandom.com/wiki/Vergei" },
  { "id": "SAA-002", "image": "images/characters/keni-wang.webp", "source_url": "https://hunterxhunter.fandom.com/wiki/Ken%27i_Wang" },
  { "id": "SAA-004", "image": "images/characters/tajao.webp", "source_url": "https://hunterxhunter.fandom.com/wiki/Tajao" },
  { "id": "JUD-002", "image": "images/characters/worio-bay.webp", "source_url": "https://hunterxhunter.fandom.com/wiki/Worio_Bay" },
  { "id": "P03-P01", "image": "images/characters/tenftory.webp", "source_url": "https://hunterxhunter.fandom.com/wiki/Tenftory" },
  { "id": "P06-P06", "image": "images/characters/prince-of-moony.webp", "source_url": "https://hunterxhunter.fandom.com/wiki/Prince_of_Moony" },
  { "id": "HA-007", "image": "images/characters/skalt-ch389.png", "source_chapter": 389, "source_note": "第389話より：名前が併記された警護兵紹介図" },
  { "id": "P14-P02", "image": "images/characters/woody.webp", "source_url": "https://hunterxhunter.fandom.com/wiki/Woody" },
  { "id": "EII-005", "image": "images/characters/tevelares.webp", "source_url": "https://hunterxhunter.fandom.com/wiki/Tevelares" },
  { "id": "Q02-S01", "image": "images/characters/mandam.webp", "source_url": "https://hunterxhunter.fandom.com/wiki/Mandam" },
  { "id": "JUD-003", "image": "images/characters/cleapatro.webp", "source_url": "https://hunterxhunter.fandom.com/wiki/Cleapatro" },
  { "id": "P09-P05", "image": "images/characters/sumidori.webp", "source_url": "https://hunterxhunter.fandom.com/wiki/Sumidori" },
  { "id": "P04-L01", "image": "images/characters/otocin.webp", "source_url": "https://hunterxhunter.fandom.com/wiki/Otocin" },
  { "id": "P04-L02", "image": "images/characters/momolly.webp", "source_url": "https://hunterxhunter.fandom.com/wiki/Momolly" },
  { "id": "P09-G01", "image": "images/characters/orzny.webp", "source_url": "https://hunterxhunter.fandom.com/wiki/Orzny" },
  { "id": "EII-009", "image": "images/characters/dogman.webp", "source_url": "https://hunterxhunter.fandom.com/wiki/Dogman" },
  { "id": "P13-M01", "image": "images/characters/naipei.webp", "source_url": "https://hunterxhunter.fandom.com/wiki/Naipei" },
  { "id": "P11-M03", "image": "images/characters/toneaster.webp", "source_url": "https://hunterxhunter.fandom.com/wiki/Toneaster" },
  { "id": "P10-M03", "image": "images/characters/roccoli.webp", "source_url": "https://hunterxhunter.fandom.com/wiki/Roccoli" },
  { "id": "P10-M04", "image": "images/characters/lizlura.webp", "source_url": "https://hunterxhunter.fandom.com/wiki/Lizlura" },
  { "id": "P04-P06", "image": "images/characters/gipper.webp", "source_url": "https://hunterxhunter.fandom.com/wiki/Gipper" },
  { "id": "P07-G07", "image": "images/characters/javietti.webp", "source_url": "https://hunterxhunter.fandom.com/wiki/Javietti" },
  { "id": "P14-M02", "image": "images/characters/shimanu.webp", "source_url": "https://hunterxhunter.fandom.com/wiki/Shimanu" },
  { "id": "P01-P16", "image": "images/characters/chiyamasi.webp", "source_url": "https://hunterxhunter.fandom.com/wiki/Chiyamasi" },
  { "id": "P07-U01", "image": "images/characters/luzurus-guard-1.webp", "source_url": "https://hunterxhunter.fandom.com/wiki/File:Luzurus%27s_Personal_Guard_1_SC_Portrait.png" },
  { "id": "KNG-002", "image": "images/characters/nugui.webp", "source_url": "https://hunterxhunter.fandom.com/wiki/File:Nugui_SC_Portrait.png" },
  { "id": "EII-010", "image": "images/characters/cashew.webp", "source_url": "https://hunterxhunter.fandom.com/wiki/File:Cashew_SC_Portrait.png" },
  { "id": "P03-P02", "image": "images/characters/sakata.webp", "source_url": "https://hunterxhunter.fandom.com/wiki/File:Sakata_SC_Portrait.png" },
  { "id": "SPD-008", "image": "images/characters/pt-manga-machi.webp", "source_chapter": 377, "source_image": "8-写真8.jpg" },
  { "id": "SPD-009", "image": "images/characters/pt-manga-kalluto.webp", "source_chapter": 377, "source_image": "8-写真8.jpg" },
  { "id": "SPD-010", "image": "images/characters/pt-manga-illumi.webp", "source_chapter": 377, "source_image": "8-写真8.jpg" },
  { "id": "EII-011", "image": "images/characters/gelato.webp", "source_url": "https://hunterxhunter.fandom.com/wiki/File:Gelato_SC_Portrait.png" },
  { "id": "EII-012", "image": "images/characters/daemon.webp", "source_url": "https://hunterxhunter.fandom.com/wiki/File:Daemon_SC_Portrait.png" },
  { "id": "EII-013", "image": "images/characters/bille.webp", "source_url": "https://hunterxhunter.fandom.com/wiki/File:Bille_SC_Portrait.png" },
  { "id": "EII-014", "image": "images/characters/perigord.webp", "source_url": "https://hunterxhunter.fandom.com/wiki/File:Perigord_SC_Portrait.png" },
  { "id": "EII-015", "image": "images/characters/voconte.webp", "source_url": "https://hunterxhunter.fandom.com/wiki/File:Voconte_SC_Portrait.png" },
  { "id": "EII-016", "image": "images/characters/matvere.webp", "source_url": "https://hunterxhunter.fandom.com/wiki/File:Matvere_SC_Portrait.png" },